{
  "schema_version": "0.1",
  "doc_type": "ppt",
  "locale": "zh-CN",
  "template_id": "ppt_tech_blue_01",
  "meta": {
    "generated_at": "2026-06-05T20:00:00Z",
    "llm_model": "deepseek-chat",
    "request_summary": "为 console.therasik.com 药物设计平台做一份招商 PPT",
    "credit_estimate": 120,
    "status": "draft"
  },
  "brand": {
    "primary_color": "#1E3A8A",
    "secondary_color": "#0EA5E9",
    "font_family": "思源黑体",
    "logo_asset_id": null
  },
  "blocks": [
    {
      "block_id": "p1",
      "layout": "cover",
      "text": {
        "title": "console.therasik.com",
        "subtitle": "AI 驱动的抗体药物设计平台",
        "tag": "企业招商"
      },
      "visual": {
        "intent": "科技感蓝色抽象分子网络背景，高端、留白",
        "prompt_en": "abstract deep-blue molecular network background, high-tech, clean negative space, premium corporate, no text",
        "role": "background",
        "aspect_ratio": "16:9",
        "preferred_tier": "premium",
        "negative": "text, watermark, logo, cluttered",
        "resolved": null
      }
    },
    {
      "block_id": "p2",
      "layout": "title_bullets",
      "text": { "title": "平台核心能力" },
      "bullets": [
        "VH/VL 与 VHH 抗体人源化全流程",
        "虚拟亲和力成熟与 ΔΔG 预测",
        "CMC 可开发性评估与结构 QC",
        "标准化、可审计的版本化报告输出"
      ],
      "visual": null
    },
    {
      "block_id": "p3",
      "layout": "image_right",
      "text": {
        "title": "为什么选择我们",
        "body": "聚合海外高质量算法与本地化工作流，输出可编辑、可交付的工程报告，而非一次性结果。"
      },
      "visual": {
        "intent": "实验室与AI结合的简洁插画",
        "prompt_en": "minimal flat illustration of a lab merged with AI neural elements, blue palette, corporate",
        "role": "illustration",
        "aspect_ratio": "4:3",
        "preferred_tier": "standard",
        "resolved": null
      }
    },
    {
      "block_id": "p4",
      "layout": "big_number",
      "text": {
        "title": "交付效率",
        "subtitle": "从序列到可交付报告",
        "caption": "对比传统人工流程"
      },
      "bullets": ["10x 更快", "15+ 结构指标", "100% 可审计"],
      "visual": null
    }
  ]
}
